{
  "title": "反复跳跃",
  "key": "C",
  "timeSignature": {
    "numerator": 4,
    "denominator": 4
  },
  "measures": [
    {
      "notes": [
        {
          "pitch": 5,
          "duration": 0.5,
          "lyric": "前"
        },
        {
          "pitch": 3,
          "duration": 0.5,
          "lyric": "奏"
        },
        {
          "pitch": 2,
          "duration": 0.5,
          "lyric": "段"
        },
        {
          "pitch": 1,
          "duration": 0.5,
          "lyric": "落"
        },
        {
          "pitch": 5,
          "duration": 0.5,
          "lyric": "~~"
        },
        {
          "pitch": 3,
          "duration": 0.5,
          "lyric": "~~"
        },
        {
          "pitch": 2,
          "duration": 0.5,
          "lyric": "~~"
        },
        {
          "pitch": 1,
          "duration": 0.5,
          "lyric": "~~"
        }
      ]
    },
    {
      "notes": [
        {
          "pitch": 6,
          "duration": 0.5,
          "octave": -1,
          "lyric": "主"
        },
        {
          "pitch": 1,
          "duration": 0.5,
          "lyric": "题"
        },
        {
          "pitch": 2,
          "duration": 0.5,
          "lyric": "乐"
        },
        {
          "pitch": 3,
          "duration": 0.5,
          "lyric": "段"
        },
        {
          "pitch": 5,
          "duration": 0.5,
          "lyric": "~~"
        },
        {
          "pitch": 6,
          "duration": 0.5,
          "lyric": "~~"
        },
        {
          "pitch": 5,
          "duration": 0.5,
          "lyric": "~~"
        },
        {
          "pitch": 3,
          "duration": 0.5,
          "lyric": "~~"
        }
      ]
    },
    {
      "notes": [
        {
          "pitch": 1,
          "duration": 1,
          "lyric": "反"
        },
        {
          "pitch": 2,
          "duration": 0.5,
          "lyric": "复"
        },
        {
          "pitch": 3,
          "duration": 0.5,
          "lyric": "开"
        },
        {
          "pitch": 5,
          "duration": 0.5,
          "lyric": "始"
        },
        {
          "pitch": 6,
          "duration": 0.5,
          "lyric": "~~"
        },
        {
          "pitch": 5,
          "duration": 0.5,
          "lyric": "~~"
        },
        {
          "pitch": 3,
          "duration": 0.5,
          "lyric": "~~"
        },
        {
          "pitch": 2,
          "duration": 0.5,
          "lyric": "~~"
        }
      ],
      "barline": "repeat-start"
    },
    {
      "notes": [
        {
          "pitch": 1,
          "duration": 1,
          "lyric": "一"
        },
        {
          "pitch": 5,
          "duration": 0.5,
          "lyric": "房"
        },
        {
          "pitch": 3,
          "duration": 0.5,
          "lyric": "结"
        },
        {
          "pitch": 2,
          "duration": 1,
          "lyric": "尾"
        },
        {
          "pitch": 1,
          "duration": 0.5,
          "lyric": "~~"
        }
      ],
      "repeatEnding": {
        "numbers": [
          1
        ]
      },
      "barline": "double"
    },
    {
      "notes": [
        {
          "pitch": 5,
          "duration": 0.5,
          "lyric": "间"
        },
        {
          "pitch": 3,
          "duration": 0.5,
          "lyric": "奏"
        },
        {
          "pitch": 2,
          "duration": 0.5,
          "lyric": "过"
        },
        {
          "pitch": 1,
          "duration": 0.5,
          "lyric": "渡"
        },
        {
          "pitch": 6,
          "duration": 0.5,
          "octave": -1,
          "lyric": "~~"
        },
        {
          "pitch": 5,
          "duration": 0.5,
          "lyric": "~~"
        },
        {
          "pitch": 6,
          "duration": 0.25,
          "octave": -1
        },
        {
          "pitch": 1,
          "duration": 0.25,
          "lyric": "~~"
        },
        {
          "pitch": 2,
          "duration": 0.5,
          "lyric": "~~"
        }
      ]
    },
    {
      "notes": [
        {
          "pitch": 1,
          "duration": 1,
          "lyric": "二"
        },
        {
          "pitch": 5,
          "duration": 0.5,
          "lyric": "房"
        },
        {
          "pitch": 3,
          "duration": 0.5,
          "lyric": "终"
        },
        {
          "pitch": 2,
          "duration": 1,
          "lyric": "止"
        },
        {
          "pitch": 1,
          "duration": 1
        }
      ],
      "repeatEnding": {
        "numbers": [
          2
        ]
      },
      "barline": "end"
    }
  ]
}