{
  "title": "连音与圆滑线",
  "key": "C",
  "timeSignature": {
    "numerator": 4,
    "denominator": 4
  },
  "measures": [
    {
      "notes": [
        {
          "pitch": 5,
          "duration": 0.5,
          "lyric": "圆",
          "slurId": "a1"
        },
        {
          "pitch": 3,
          "duration": 0.5,
          "lyric": "滑",
          "slurId": "a1"
        },
        {
          "pitch": 2,
          "duration": 0.5,
          "lyric": "圆",
          "slurId": "a2"
        },
        {
          "pitch": 1,
          "duration": 0.5,
          "lyric": "滑",
          "slurId": "a2"
        },
        {
          "pitch": 6,
          "duration": 0.5,
          "octave": -1,
          "lyric": "圆",
          "slurId": "a3"
        },
        {
          "pitch": 1,
          "duration": 0.5,
          "lyric": "滑",
          "slurId": "a3"
        },
        {
          "pitch": 2,
          "duration": 0.5,
          "lyric": "~"
        },
        {
          "pitch": 3,
          "duration": 0.5,
          "lyric": "~"
        }
      ]
    },
    {
      "notes": [
        {
          "pitch": 5,
          "duration": 1,
          "lyric": "连",
          "tieId": "t1"
        },
        {
          "pitch": 5,
          "duration": 0.5,
          "tieId": "t1"
        },
        {
          "pitch": 5,
          "duration": 0.5,
          "lyric": "音"
        },
        {
          "pitch": 3,
          "duration": 1,
          "lyric": "连",
          "tieId": "t2"
        },
        {
          "pitch": 3,
          "duration": 0.5,
          "tieId": "t2"
        },
        {
          "pitch": 3,
          "duration": 0.5,
          "lyric": "音"
        }
      ]
    },
    {
      "notes": [
        {
          "pitch": 1,
          "duration": 0.5,
          "octave": 1,
          "lyric": "月",
          "slurId": "a4"
        },
        {
          "pitch": 6,
          "duration": 0.5,
          "lyric": "亮",
          "slurId": "a4"
        },
        {
          "pitch": 5,
          "duration": 0.5,
          "lyric": "代",
          "slurId": "a5"
        },
        {
          "pitch": 3,
          "duration": 0.5,
          "lyric": "表",
          "slurId": "a5"
        },
        {
          "pitch": 5,
          "duration": 0.5,
          "lyric": "我",
          "slurId": "a6"
        },
        {
          "pitch": 3,
          "duration": 0.5,
          "lyric": "的",
          "slurId": "a6"
        },
        {
          "pitch": 2,
          "duration": 0.5,
          "lyric": "心"
        },
        {
          "pitch": 1,
          "duration": 0.5
        }
      ]
    },
    {
      "notes": [
        {
          "pitch": 5,
          "duration": 1,
          "lyric": "跨",
          "tieId": "long_tie"
        },
        {
          "pitch": 5,
          "duration": 0.5,
          "tieId": "long_tie"
        },
        {
          "pitch": 3,
          "duration": 0.5,
          "lyric": "节"
        },
        {
          "pitch": 2,
          "duration": 1,
          "lyric": "大",
          "slurId": "a7"
        },
        {
          "pitch": 1,
          "duration": 1,
          "lyric": "圆",
          "slurId": "a7"
        }
      ]
    }
  ]
}