{
  "title": "综合符号示例",
  "key": "C",
  "timeSignature": {
    "numerator": 4,
    "denominator": 4
  },
  "measures": [
    {
      "notes": [
        {
          "pitch": 5,
          "duration": 0.5,
          "lyric": "综"
        },
        {
          "pitch": 3,
          "duration": 0.25,
          "lyric": "合"
        },
        {
          "pitch": 2,
          "duration": 0.25
        },
        {
          "pitch": 1,
          "duration": 0.5,
          "lyric": "符",
          "techniques": [
            {
              "type": "boyin"
            }
          ]
        },
        {
          "pitch": 6,
          "duration": 0.5,
          "octave": -1,
          "lyric": "号"
        },
        {
          "pitch": 1,
          "duration": 0.5,
          "lyric": "大"
        },
        {
          "pitch": 2,
          "duration": 0.5,
          "lyric": "全"
        }
      ]
    },
    {
      "notes": [
        {
          "pitch": 3,
          "duration": 0.5,
          "lyric": "顿",
          "techniques": [
            {
              "type": "dunyin"
            }
          ]
        },
        {
          "pitch": 5,
          "duration": 0.25,
          "lyric": "滑",
          "techniques": [
            {
              "type": "huayin",
              "slideDirection": "up"
            }
          ]
        },
        {
          "pitch": 6,
          "duration": 0.25,
          "lyric": "音"
        },
        {
          "pitch": 3,
          "duration": 0.5,
          "lyric": "波",
          "techniques": [
            {
              "type": "boyin"
            }
          ]
        },
        {
          "pitch": 2,
          "duration": 0.5,
          "lyric": "保",
          "tenuto": true
        },
        {
          "pitch": 1,
          "duration": 0.5,
          "lyric": "延",
          "fermata": true
        },
        {
          "pitch": 5,
          "duration": 0.25,
          "accidental": "sharp",
          "techniques": [
            {
              "type": "dayin"
            }
          ]
        },
        {
          "pitch": 3,
          "duration": 0.25,
          "lyric": "~"
        },
        {
          "pitch": 2,
          "duration": 0.5,
          "lyric": "~"
        }
      ]
    },
    {
      "notes": [
        {
          "pitch": 6,
          "duration": 0.5,
          "lyric": "打",
          "techniques": [
            {
              "type": "dayin"
            }
          ]
        },
        {
          "pitch": 1,
          "duration": 0.5,
          "octave": 1,
          "lyric": "叠",
          "techniques": [
            {
              "type": "dieyin"
            }
          ]
        },
        {
          "pitch": 5,
          "duration": 0.5,
          "lyric": "吐",
          "techniques": [
            {
              "type": "tuyin"
            }
          ]
        },
        {
          "pitch": 3,
          "duration": 0.5,
          "lyric": "倚",
          "techniques": [
            {
              "type": "yinyin",
              "graceNotes": [
                2
              ],
              "graceOctave": 0
            }
          ]
        },
        {
          "pitch": 5,
          "duration": 0.5,
          "lyric": "颤",
          "techniques": [
            {
              "type": "chanyin"
            }
          ]
        },
        {
          "pitch": 6,
          "duration": 0.5,
          "lyric": "顿",
          "techniques": [
            {
              "type": "dunyin"
            }
          ]
        },
        {
          "pitch": 5,
          "duration": 0.5,
          "lyric": "~"
        }
      ]
    },
    {
      "notes": [
        {
          "pitch": 1,
          "duration": 1,
          "octave": 1,
          "lyric": "低",
          "slurId": "z1"
        },
        {
          "pitch": 6,
          "duration": 0.5,
          "lyric": "音",
          "slurId": "z1"
        },
        {
          "pitch": 5,
          "duration": 1,
          "lyric": "连",
          "tieId": "zt1"
        },
        {
          "pitch": 5,
          "duration": 0.5,
          "lyric": "~",
          "tieId": "zt1"
        },
        {
          "pitch": 3,
          "duration": 0.5,
          "lyric": "~"
        },
        {
          "pitch": 2,
          "duration": 0.25,
          "lyric": "~"
        },
        {
          "pitch": 1,
          "duration": 0.25,
          "lyric": "~"
        }
      ]
    },
    {
      "notes": [
        {
          "pitch": 2,
          "duration": 0.5,
          "lyric": "跨",
          "slurId": "z2"
        },
        {
          "pitch": 3,
          "duration": 0.5,
          "lyric": "节",
          "slurId": "z2"
        },
        {
          "pitch": 5,
          "duration": 1,
          "lyric": "长",
          "fermata": true
        },
        {
          "pitch": 6,
          "duration": 0.5,
          "octave": -1,
          "techniques": [
            {
              "type": "dunyin"
            }
          ]
        },
        {
          "pitch": 1,
          "duration": 0.5,
          "lyric": "止"
        },
        {
          "pitch": 2,
          "duration": 1
        }
      ],
      "barline": "end"
    }
  ]
}