{
  "title": "八度与变音",
  "key": "C",
  "timeSignature": {
    "numerator": 4,
    "denominator": 4
  },
  "measures": [
    {
      "notes": [
        {
          "pitch": 5,
          "duration": 0.5,
          "octave": 1,
          "lyric": "高"
        },
        {
          "pitch": 6,
          "duration": 0.5,
          "octave": 1,
          "lyric": "八"
        },
        {
          "pitch": 1,
          "duration": 0.5,
          "octave": 2,
          "lyric": "度"
        },
        {
          "pitch": 5,
          "duration": 0.5,
          "lyric": "中"
        },
        {
          "pitch": 3,
          "duration": 0.5,
          "lyric": "音"
        },
        {
          "pitch": 1,
          "duration": 0.5,
          "lyric": "区"
        },
        {
          "pitch": 6,
          "duration": 0.5,
          "lyric": "~"
        },
        {
          "pitch": 5,
          "duration": 0.5,
          "lyric": "~"
        }
      ]
    },
    {
      "notes": [
        {
          "pitch": 5,
          "duration": 0.5,
          "octave": -1,
          "lyric": "低"
        },
        {
          "pitch": 6,
          "duration": 0.5,
          "octave": -1,
          "lyric": "八"
        },
        {
          "pitch": 1,
          "duration": 0.5,
          "octave": -1,
          "lyric": "度"
        },
        {
          "pitch": 2,
          "duration": 0.5,
          "lyric": "低"
        },
        {
          "pitch": 3,
          "duration": 0.5,
          "lyric": "音"
        },
        {
          "pitch": 2,
          "duration": 0.5,
          "lyric": "区"
        },
        {
          "pitch": 1,
          "duration": 0.5,
          "lyric": "~"
        },
        {
          "pitch": 6,
          "duration": 0.25,
          "octave": -1,
          "lyric": "~"
        },
        {
          "pitch": 5,
          "duration": 0.25,
          "octave": -1
        }
      ]
    },
    {
      "notes": [
        {
          "pitch": 5,
          "duration": 0.5,
          "accidental": "sharp",
          "lyric": "升"
        },
        {
          "pitch": 6,
          "duration": 0.5,
          "accidental": "sharp",
          "lyric": "号"
        },
        {
          "pitch": 3,
          "duration": 0.5,
          "accidental": "flat",
          "lyric": "降"
        },
        {
          "pitch": 2,
          "duration": 0.5,
          "accidental": "flat",
          "lyric": "号"
        },
        {
          "pitch": 1,
          "duration": 0.5,
          "accidental": "natural",
          "lyric": "还"
        },
        {
          "pitch": 2,
          "duration": 0.5,
          "accidental": "natural",
          "lyric": "原"
        },
        {
          "pitch": 3,
          "duration": 0.5,
          "lyric": "~"
        },
        {
          "pitch": 5,
          "duration": 0.5,
          "lyric": "~"
        }
      ]
    },
    {
      "notes": [
        {
          "pitch": 1,
          "duration": 1,
          "lyric": "低"
        },
        {
          "pitch": 5,
          "duration": 1,
          "octave": -1
        },
        {
          "pitch": 6,
          "duration": 0.5,
          "octave": -1,
          "lyric": "高"
        },
        {
          "pitch": 1,
          "duration": 0.5,
          "octave": 1
        },
        {
          "pitch": 2,
          "duration": 0.5,
          "octave": 1,
          "lyric": "~"
        },
        {
          "pitch": 3,
          "duration": 0.5,
          "octave": 1
        }
      ]
    }
  ]
}