{
  "title": "打音与吐音",
  "key": "C",
  "timeSignature": {
    "numerator": 4,
    "denominator": 4
  },
  "measures": [
    {
      "notes": [
        {
          "pitch": 5,
          "duration": 0.5,
          "lyric": "打",
          "techniques": [
            {
              "type": "dayin"
            }
          ]
        },
        {
          "pitch": 3,
          "duration": 0.5,
          "lyric": "音"
        },
        {
          "pitch": 2,
          "duration": 0.5,
          "lyric": "~"
        },
        {
          "pitch": 1,
          "duration": 0.5,
          "lyric": "打",
          "techniques": [
            {
              "type": "dayin"
            }
          ]
        },
        {
          "pitch": 6,
          "duration": 0.5,
          "octave": -1,
          "lyric": "音"
        },
        {
          "pitch": 5,
          "duration": 0.5,
          "lyric": "~"
        },
        {
          "pitch": 3,
          "duration": 0.5,
          "techniques": [
            {
              "type": "dayin"
            }
          ]
        },
        {
          "pitch": 2,
          "duration": 0.5,
          "lyric": "打"
        }
      ]
    },
    {
      "notes": [
        {
          "pitch": 1,
          "duration": 0.5,
          "lyric": "吐",
          "techniques": [
            {
              "type": "tuyin"
            }
          ]
        },
        {
          "pitch": 2,
          "duration": 0.5,
          "lyric": "音"
        },
        {
          "pitch": 3,
          "duration": 0.5,
          "lyric": "~"
        },
        {
          "pitch": 5,
          "duration": 0.5,
          "lyric": "吐",
          "techniques": [
            {
              "type": "tuyin"
            }
          ]
        },
        {
          "pitch": 6,
          "duration": 0.5,
          "lyric": "音"
        },
        {
          "pitch": 5,
          "duration": 0.5,
          "lyric": "~"
        },
        {
          "pitch": 6,
          "duration": 0.5,
          "techniques": [
            {
              "type": "tuyin"
            }
          ]
        },
        {
          "pitch": 1,
          "duration": 0.5,
          "octave": 1,
          "lyric": "~"
        }
      ]
    },
    {
      "notes": [
        {
          "pitch": 3,
          "duration": 0.5,
          "lyric": "吐",
          "techniques": [
            {
              "type": "tuyin"
            }
          ]
        },
        {
          "pitch": 5,
          "duration": 0.5,
          "lyric": "音"
        },
        {
          "pitch": 6,
          "duration": 0.5,
          "lyric": "~"
        },
        {
          "pitch": 1,
          "duration": 0.5,
          "octave": 1,
          "techniques": [
            {
              "type": "tuyin"
            }
          ]
        },
        {
          "pitch": 6,
          "duration": 0.5,
          "lyric": "音"
        },
        {
          "pitch": 5,
          "duration": 0.5,
          "lyric": "~"
        },
        {
          "pitch": 3,
          "duration": 0.5,
          "techniques": [
            {
              "type": "tuyin"
            }
          ]
        },
        {
          "pitch": 2,
          "duration": 0.5,
          "lyric": "~"
        },
        {
          "pitch": 1,
          "duration": 0.5,
          "lyric": "~"
        }
      ]
    },
    {
      "notes": [
        {
          "pitch": 5,
          "duration": 0.5,
          "lyric": "打",
          "techniques": [
            {
              "type": "dayin"
            }
          ]
        },
        {
          "pitch": 6,
          "duration": 0.5,
          "lyric": "吐",
          "techniques": [
            {
              "type": "tuyin"
            }
          ]
        },
        {
          "pitch": 3,
          "duration": 0.5,
          "lyric": "打",
          "techniques": [
            {
              "type": "dayin"
            }
          ]
        },
        {
          "pitch": 5,
          "duration": 0.5,
          "lyric": "吐",
          "techniques": [
            {
              "type": "tuyin"
            }
          ]
        },
        {
          "pitch": 6,
          "duration": 0.5,
          "lyric": "~"
        },
        {
          "pitch": 5,
          "duration": 0.5,
          "lyric": "~"
        },
        {
          "pitch": 2,
          "duration": 0.5,
          "lyric": "~"
        },
        {
          "pitch": 1,
          "duration": 0.5,
          "lyric": "~"
        }
      ]
    }
  ]
}