{
  "title": "波音颤音倚音",
  "key": "C",
  "timeSignature": {
    "numerator": 4,
    "denominator": 4
  },
  "measures": [
    {
      "notes": [
        {
          "pitch": 5,
          "duration": 0.5,
          "lyric": "波",
          "techniques": [
            {
              "type": "boyin"
            }
          ]
        },
        {
          "pitch": 3,
          "duration": 0.5,
          "lyric": "音"
        },
        {
          "pitch": 2,
          "duration": 0.5,
          "lyric": "~"
        },
        {
          "pitch": 1,
          "duration": 0.5,
          "lyric": "波",
          "techniques": [
            {
              "type": "boyin"
            }
          ]
        },
        {
          "pitch": 6,
          "duration": 0.5,
          "octave": -1,
          "lyric": "音"
        },
        {
          "pitch": 1,
          "duration": 0.5,
          "techniques": [
            {
              "type": "boyin"
            }
          ]
        },
        {
          "pitch": 2,
          "duration": 0.5,
          "lyric": "波"
        },
        {
          "pitch": 3,
          "duration": 0.25,
          "lyric": "音"
        },
        {
          "pitch": 5,
          "duration": 0.25,
          "techniques": [
            {
              "type": "boyin"
            }
          ]
        }
      ]
    },
    {
      "notes": [
        {
          "pitch": 6,
          "duration": 0.5,
          "lyric": "颤",
          "techniques": [
            {
              "type": "chanyin"
            }
          ]
        },
        {
          "pitch": 5,
          "duration": 0.5,
          "lyric": "音"
        },
        {
          "pitch": 3,
          "duration": 0.5,
          "lyric": "~"
        },
        {
          "pitch": 2,
          "duration": 0.5,
          "lyric": "颤",
          "techniques": [
            {
              "type": "chanyin"
            }
          ]
        },
        {
          "pitch": 1,
          "duration": 1,
          "techniques": [
            {
              "type": "chanyin"
            }
          ]
        },
        {
          "pitch": 5,
          "duration": 0.5,
          "lyric": "颤"
        },
        {
          "pitch": 6,
          "duration": 0.5,
          "techniques": [
            {
              "type": "chanyin"
            }
          ]
        }
      ]
    },
    {
      "notes": [
        {
          "pitch": 5,
          "duration": 0.5,
          "lyric": "倚",
          "techniques": [
            {
              "type": "yinyin",
              "graceNotes": [
                3
              ],
              "graceOctave": 0
            }
          ]
        },
        {
          "pitch": 6,
          "duration": 0.5,
          "lyric": "音"
        },
        {
          "pitch": 5,
          "duration": 0.5,
          "lyric": "~"
        },
        {
          "pitch": 3,
          "duration": 0.5,
          "lyric": "倚",
          "techniques": [
            {
              "type": "yinyin",
              "graceNotes": [
                6
              ],
              "graceOctave": 0
            }
          ]
        },
        {
          "pitch": 2,
          "duration": 0.5,
          "lyric": "音"
        },
        {
          "pitch": 1,
          "duration": 0.5,
          "lyric": "~"
        },
        {
          "pitch": 5,
          "duration": 0.25,
          "techniques": [
            {
              "type": "yinyin",
              "graceNotes": [
                3
              ],
              "graceOctave": 0
            }
          ]
        },
        {
          "pitch": 3,
          "duration": 0.25
        },
        {
          "pitch": 2,
          "duration": 0.5,
          "lyric": "~"
        }
      ]
    },
    {
      "notes": [
        {
          "pitch": 1,
          "duration": 1,
          "lyric": "波",
          "techniques": [
            {
              "type": "boyin"
            }
          ]
        },
        {
          "pitch": 5,
          "duration": 0.5,
          "lyric": "颤",
          "techniques": [
            {
              "type": "chanyin"
            }
          ]
        },
        {
          "pitch": 6,
          "duration": 0.5,
          "lyric": "倚",
          "techniques": [
            {
              "type": "yinyin",
              "graceNotes": [
                3
              ],
              "graceOctave": 0
            }
          ]
        },
        {
          "pitch": 5,
          "duration": 0.5,
          "lyric": "波",
          "techniques": [
            {
              "type": "boyin"
            }
          ]
        },
        {
          "pitch": 3,
          "duration": 0.5,
          "lyric": "~"
        },
        {
          "pitch": 2,
          "duration": 0.5,
          "lyric": "~"
        },
        {
          "pitch": 1,
          "duration": 0.5,
          "lyric": "~"
        }
      ]
    }
  ]
}